Resource Theme Name,Resource Name,Resource Type,URL,ResourceCatalogueURL,Priority,Description
Galaxy Workflow Management System,Xray Larch Documentation,Guidance,https://xraypy.github.io/xraylarch,https://resources.psdi.ac.uk/guidance/b1dda790-7dcb-4588-899a-238080ed7c58,2.0,"Documentation for the underlying Larch open-source library that has been implemented as a Galaxy tool in our Galaxy instance. Larch is used for processing and analysing X-ray absorption and fluorescence spectroscopy data, and X-ray fluorescence and diffraction image data obtained from synchrotron beamlines. Larch provides a comprehensive set of analysis tools for X-ray absorption fine-structure spectroscopy (XAFS), including both X-ray absorption near-edge spectroscopy (XANES) and extended X-ray absorption fine-structure spectroscopy (EXAFS). Larch also provides visualization and analysis tools for X-ray fluorescence (XRF) spectra and XRF and X-ray diffraction (XRD) images as collected at scanning X-ray microprobe beamlines."
Galaxy Workflow Management System,Mini-Tutorials for XAFS RO-Crate Workflows in Galaxy,Guidance,http://xerte.cardiff.ac.uk/play_22519,https://resources.psdi.ac.uk/guidance/f8c98217-7299-44f5-9a35-dac6c32ec52e,2.0,"The Mini-Tutorials for XAFS RO-Crate Workflows in Galaxy provide a brief introduction to working with RO-Crates in Galaxy. The development of the tutorials originated as quickstart guidance for running and inspecting workflows used for the reproduction of X-ray absorption fine structure (XAFS) analyses. These self-paced learning resources cover three aspects of the RO-Crate lifecycle in the Galaxy platform: Importing (and running) a workflow, Creation (Exporting) an RO-Crate and Importing (and inspecting) an RO-Crate."
PSDI Skills4Scientists,Python I Skills4Scientists,Guidance,https://learn.psdi.ac.uk/moodle/course/view.php?name=python1,https://resources.psdi.ac.uk/guidance/d3e919be-ec5c-4164-95f8-8b94c83280f7,2.0,"This course is designed to teach participants the basics of programming using Python. For new programmers, the course will teach you the fundamentals of programming using Python as an example. Whilst those who are more familiar with programming concepts can use the course to learn Python syntax and its unique features."
PSDI Skills4Scientists,Python II Skills4Scientists,Guidance,https://learn.psdi.ac.uk/moodle/course/view.php?name=python2,https://resources.psdi.ac.uk/guidance/294760c8-20de-4155-9951-08bccc87a593,2.0,"This course builds on the basics of programming covered in the Python I course. For beginners, it expands on the foundational concepts taught in first course. For more experienced programmers, further examples and guidance are added to help you master Python syntax and its unique features."
PSDI Skills4Scientists,Version Control and Github Skills4Scientists,Guidance,https://learn.psdi.ac.uk/moodle/course/view.php?name=versioncontrol,https://resources.psdi.ac.uk/guidance/0b8c77cf-0e18-4f15-b75f-81a8ed655fbc,2.0,"This course is designed to help participants understand the principles of version control and how it can be used effectively in research projects. Participants will explore common version control methods, learn the associated terminology and find out how software like GitHub implements these methods."
PSDI Skills4Scientists,Ethics Skills4Scientists,Guidance,https://learn.psdi.ac.uk/moodle/course/view.php?name=ethics,https://resources.psdi.ac.uk/guidance/e14e0d9e-8bca-43d1-96c5-36f274a5ace0,2.0,"This course provides an introduction to the subject of ethics and research integrity. This includes details of the ethical review process, how ethics needs to be applied to data that is used for Machine Learning and Artificial Intelligence. The course also provides guidance on Responsible Research and Innovation."
PSDI Skills4Scientists,Literature and Referencing Skills4Scientists,Guidance,https://learn.psdi.ac.uk/moodle/course/view.php?name=litandref,https://resources.psdi.ac.uk/guidance/b67907c2-490b-445c-8420-fee8cdde1cd1,2.0,"This course covers the fundamentals of literature and referencing in the physical sciences. Participants will learn to identify various scholarly sources, understand the purposes of citations, and appreciate their importance in the scientific process.This course covers the fundamentals of literature and referencing in the physical sciences. Participants will learn to identify various scholarly sources, understand the purposes of citations, and appreciate their importance in the scientific process."
PSDI Skills4Scientists,Research Data Management Skills4Scientists,Guidance,https://learn.psdi.ac.uk/moodle/course/view.php?name=rdm,https://resources.psdi.ac.uk/guidance/76a1e069-ada0-41a6-bff9-fa7236d3a4ae,2.0,"This course provides an introduction to Research Data Management. Participants will explore the data lifecycle, identify its various stages, understand the importance of collaborative working environments, and learn how to identify and manage different types of data within their projects."
PSDI Skills4Scientists,Databases Skills4Scientists,Guidance,https://learn.psdi.ac.uk/moodle/course/view.php?name=databases,https://resources.psdi.ac.uk/guidance/c6f97277-b785-4951-bd2d-3a45b96a7f88,2.0,"This course provides an introduction to using Command line functionality basics such as Shell, Echo and commands. It also covers: navigating a directory structure; understanding input, output and error streams from programs in shells; and how to write a Bash script to undertake repetitive tasks; how to use Git as a version control tool in the command line."
PSDI Skills4Scientists,Data Visualisation Skills4Scientists,Guidance,https://learn.psdi.ac.uk/moodle/course/view.php?name=datavis,https://resources.psdi.ac.uk/guidance/3894adca-5032-495d-aa36-8a0d00cfd37c,2.0,"This course provides an introduction to the concepts of good data visualisations, how colour perception is important to what graphics can show and how to implement some basic plotting using the python package matplotlib."
PSDI Skills4Scientists,Command Line: Bash and Git Skills4Scientists,Guidance,https://learn.psdi.ac.uk/moodle/course/view.php?name=bashgit,https://resources.psdi.ac.uk/guidance/1dd4ec08-6ab7-478a-b685-211f3fb3ce28,2.0,"This course provides an introduction to using Command line functionality basics such as Shell, Echo and other commands. It also covers navigating a directory structure, understanding input, output and error streams from programs in shell and how to write a Bash scrip to undertake repetitive tasks. Covered here is how to use Git as a version control tool in the command line."
SimpNMR (Software for Ab Initio Analysis of pNMR Data) and SimpNMR_DB (a Curated Database),SimpNMR_DB (a Curated Database of Analysed pNMR Spectra),Data,https://data-collections.psdi.ac.uk/communities/simpnmr_db,https://resources.psdi.ac.uk/data/37ddb0ce-30ab-4928-a1c2-35f719470137,2.0,"SimpNMR_DB is a database for ab initio calculations of hyperfine interactions that are used as inputs for SimpNMR. SimpNMR is an open-source python package that links Density Functional Theory (DFT) calculations with NMR spectra and helps to assign the peaks and extract the magnetic susceptibility tensor form paramagnetic shifts.
The dissemination of ab initio data will be invaluable to the community involved in computing magnetic properties of molecules due to the difficulty in accurate prediction. Further, when sufficiently large, we anticipate that the database will provide foundation for benchmarking and machine learned models. Therefore, we encourage researchers to share their computational output files in SimpNMR_DB to benefit the wider community.
Note that this repository is currently under rapid and active development."
SimpNMR (Software for Ab Initio Analysis of pNMR Data) and SimpNMR_DB (a Curated Database),SimpNMR (Software for Ab Initio Analysis of pNMR Data),Tool,https://pypi.org/project/simpnmr,https://resources.psdi.ac.uk/tool/3961b931-e0e5-4a0c-a65d-083b68d4f142,2.0,"SimpNMR is a Python package that simplifies analysis of the NMR spectra (e.g. 1H, 13C) of paramagnetic metal complexes in solution by incorporating outputs of ab initio calculations. It allows for prediction of the 1D spectra, assignment of experimental peaks, and fitting of the magnetic susceptibility tensor and the correlation times to experimental pNMR data. With variable temperature experiments, SimpNMR can also extract complete g-tensor in the molecular frame and in certain cases even D-tensor from solution pNMR data."
SimpNMR (Software for Ab Initio Analysis of pNMR Data) and SimpNMR_DB (a Curated Database),User and Developer Guides for SimpNMR Software,Guidance,https://simpnmr.org,https://resources.psdi.ac.uk/guidance/5cd98f00-05d6-4133-858e-d6fadc3d8655,2.0,"User guide for SimpNMR Python package (for the analysis of solution NMR data of paramagnetic metal complexes using computational chemistry methods). This user guide includes sections which cover 'Get Started' (installation instructions, workflows, and practical guidance for running prediction and fitting calculations with simpnmr), 'Tutorials' (downloadable example materials for the SimpNMR tutorials and workshop, provided as ready-to-use files from the repository), 'Developer Guide' (internal architecture, contribution guidelines, and maintenance notes for developers and advanced users) and 'Templates' (downloadable YAML templates for common prediction and fitting workflows)."
Universal Hyper Active Learning: A Data Pipeline to Accelerate Materials Discovery,Universal HAL Python package,Tool,https://github.com/kermodegroup/ase_uhal,https://resources.psdi.ac.uk/tool/a1cf2550-f834-4b94-9cce-95da5c8c17f0,2.0,"Implementation of 'Universal HyperActive Learning' compatible with the Atomic Simulation Environment (ASE). Building accurate machine learning models of atomic interactions requires carefully curated training datasets, but generating these datasets is often the hardest and most time-consuming part of the process. 'ase-uhal' is a Python tool developed through a PSDI Pilot Project (October 2025 to March 2026) that automates and accelerates this data generation step. The tool steers atomistic simulations towards configurations the model finds most informative, avoiding redundant calculations. Our 'universal' extension to the hyperactive learning (HAL) approach makes it compatible with the new generation of foundation models that can be fine-tuned for specific applications, and introduces a batched workflow that significantly improves throughput over existing methods. Now available via 'pip install ase-uhal' and integrating with the widely used ASE ecosystem, we demonstrate the approach on an InGaP alloy system, showing that models fit to diverse training data outperform those fitted using random sampling. This tool is available as code which can be installed from a github repository or PyPi and run locally."
AI Ready Datasets,AI Ready Datasets,Data,https://data-collections.psdi.ac.uk/communities/ai-ready-datasets,https://resources.psdi.ac.uk/data/1efa3139-865d-4a81-9426-3ca372217a7e,2.0,"This resource theme contains a set of datasets which are of use for Artificial Intelligence (AI) or Machine Learning (ML) tools and systems. For some datasets these are made available in a general form for consumers to use for their own application where they can decide for themselves which columns to use for categorisation/annotation, and how to split it into test, training and validation subsets. However, some are examples of datasets that have been tailored to be specific to a particular machine learning task, and have annotations, and splits between test, training and validation entries explicitly indicated. All records comprise one or more datafiles with an accompanying croissant (https://mlcommons.org/working-groups/data/croissant/) dataset description metadata json file."
Project M: Calcium Carbonate Diffraction Datasets With Fit and Parameter Data,Project M: Calcium Carbonate Diffraction Datasets With Fit and Parameter Data,Data,https://data-collections.psdi.ac.uk/communities/project-m,https://resources.psdi.ac.uk/data/c7a5caf4-5417-4de3-b2a2-c16cc24e36cb,2.0,"Project M (https://www.diamond.ac.uk/ProjectM/) was a citizen science research project with UK secondary schools that produced an open collection of over 650 diffraction datasets from calcium carbonate crystallised using a range of additives and conditions and with all fit and parameter data available. 
This collection is part of the ""AI for Science"" PSDI sub-project (""Provision of 'AI ready' data: prototyping data pipelines and repositories"", grant application APP84520, award UKRI2697, opportunity OPP1033:EPSRC AI for Science) and as such has been selected and prepared as an example of ""AI ready"" data that is useful as training data for AI tools and systems."
Machine Learning for Next-Generation Transmission Electron Microscopy (TEM),TEM-ParticlesDB: Next-Generation Transmission Electron Microscopy (TEM) images,Data,https://data-collections.psdi.ac.uk/communities/tem-particlesdb,https://resources.psdi.ac.uk/data/1c588bd2-6c7d-4f74-8b61-426b7d864d3a,2.0,"The TEM nanoparticle segmentation database (TEM-ParticlesDB) is an open-source repository of Transmission Electron Microscopy (TEM) images of nanoparticles automatically segmented using machine learning to identify size, shape and morphology of the particles observed, across a range of substrates. Each record contains experimental data, synthetic data and segmented nanoparticle data. The synthetic data is generated using the Transmission Electron Microscopy Particle Outline Segmentation (TEMPOS) software and used to train segmentation models via transfer learning, which are subsequently applied to segment experimental images."
Machine Learning for Next-Generation Transmission Electron Microscopy (TEM),TEMPOS (Transmission Electron Microscopy Particle Outline Segmentation) Github Repository,Tool,https://github.com/AMCLab/TEMPOS,https://resources.psdi.ac.uk/tool/323cc7d7-4538-47ca-bdd3-ab02194b7834,2.0,"This repostory is for TEMPOS - a GUI for generating synthetic data, appying CTF, training detectron2 models, segmenting experimental images, post processing and exporting data locally with Datasette."
Machine Learning for Next-Generation Transmission Electron Microscopy (TEM),TEMPOS (Transmission Electron Microscopy Particle Outline Segmentation) Documentation,Guidance,https://github.com/AMCLab/TEMPOS/blob/main/README.md,https://resources.psdi.ac.uk/guidance/97557d0d-af8e-4ce2-97f4-f943e21e3925,2.0,"Comprehensive documentation, including videos, for using TEMPOS - a GUI for generating synthetic data, appying CTF, training detectron2 models, segmenting experimental images, post processing and exporting data locally with Datasette. Includes sections which describe its overview, how to set up the environment to run it, how to run it, how to install it on windows, and advanced execution options."
CrystaLLM-pi (AI-driven Prediction of Crystal Structure from Composition and Experimental Data),PXRD-conditioned CrystaLLM-pi Web Application (AI-driven Prediction of Crystal Structure),Service,https://crystallm-pi.psdi.ac.uk,https://resources.psdi.ac.uk/service/32e801c3-7a81-488b-a15b-8f9240ea74b4,2.0,"The CrystaLLM-pi web application provides an accessible, browser-based interface for generating crystalline structures using state-of-the-art generative AI. Users can quickly create candidate materials either from chemical composition alone or by combining composition with experimental X-ray diffraction (XRD) data.
Designed for ease of use, the webapp enables interactive exploration of crystal structures without requiring local installation or machine learning expertise. Generated structures are returned in standard CIF format, making them ready for visualisation or downstream simulation, and supporting rapid integration into experimental and computational materials workflows."
CrystaLLM-pi (AI-driven Prediction of Crystal Structure from Composition and Experimental Data),CrystaLLM-pi (AI-driven Prediction of Crystal Structure) Github Repository,Tool,https://github.com/C-Bone-UCL/CrystaLLM-pi,https://resources.psdi.ac.uk/tool/b33b210b-93b1-495a-aa10-f38b01cd703f,2.0,"Crystallm-pi is a generative model for producing plausible structures for crystalline materials. It can be run de novo, i.e. generating a plausible material with no constraints; it can be run to generate a new crystal structure corresponding to a chemical composition; and it can also be constrained by providing an XRD pattern, such that the generated crystal should match the pattern. The code in this repo can be installed and run locally."
CrystaLLM-pi (AI-driven Prediction of Crystal Structure from Composition and Experimental Data),CrystaLLM-pi (AI-driven Prediction of Crystal Structure) Docker Container,Tool,https://github.com/C-Bone-UCL/CrystaLLM-pi,https://resources.psdi.ac.uk/tool/d2f426b2-04df-4ed1-8778-c2082852088c,2.0,"Crystallm-pi is a generative model for producing plausible structures for crystalline materials. It can be run de novo, i.e. generating a plausible material with no constraints; it can be run to generate a new crystal structure corresponding to a chemical composition; and it can also be constrained by providing an XRD pattern, such that the generated crystal should match the pattern. The docker container here contains a prebuilt environment for running the code locally."
PSDI Subscribed Resources,Cambridge Structural Database (CSD),Data,https://data-search.psdi.ac.uk/find-a-substance?db=psdi.csd,https://resources.psdi.ac.uk/data/07d83ee6-bad9-4c23-abea-ac70745b0803,1.0,"The Cambridge Structural Database (CSD), provided by the Cambridge Crystallographic Data Centre (CCDC), is the world's largest curated repository of experimental crystal structures. It contains over 1.3 million accurate 3D structures derived from X-ray, neutron, and electron diffraction analyses. The database is used by researchers across the pharmaceutical, agrochemical, and fine chemicals industries to predict and guide future discoveries. Access to the CSD through PSDI is restricted to authenticated users from the UK academic community. The CSD can be searched using the 'Find a Substance' search within the PSDI Cross Data Service or by using the dedicated webCSD service. Software for working with CSD can also be accessed using our Remote Desktop Access. 
Use the Visit or resource landing page link to search the CSD using the PSDI Cross Data Search service. See Linked Resources for links to Web Access to Cambridge Structural Database (webCSD) and CSD Software (Remote Desktop Access)."
PSDI Subscribed Resources,Inorganic Crystal Structure Database (ICSD),Data,https://data-search.psdi.ac.uk/find-a-substance?db=psdi.icsd,https://resources.psdi.ac.uk/data/9e2e6f90-262c-439e-97f1-3644fa89cb0e,1.0,"The Inorganic Crystal Structure Database (ICSD), provided by FIZ Karlsruhe, is the world's largest database for completely identified inorganic crystal structures containing over 325,000 crystal structures. Currently it contains the following types of crystal structures: experimentally determined inorganic and organometallic structures, and theoretically calculated inorganic structures. ICSD also includes simulation of powder diffraction data. Results data include unit cell, space group, complete atomic parameters, site occupation factors, Wyckoff sequence, molecular formula and weight, ANX formula, and mineral group. 
Access to ICSD through PSDI is restricted to authenticated users from the UK academic community. ICSD can be searched using the 'Find a Substance' search within the PSDI Cross Data Service or by using the dedicated ICSD Web service. 
Use the Visit or resource landing page link to search the ICSD using the PSDI Cross Data Search service. See Linked Resources for a link to the dedicated ICSD Web service."
PSDI Subscribed Resources,CSD Software (Remote Desktop Access),Service,https://guidance.psdi.ac.uk/docusaurus-pages/docs/guidance/psdi-resources/data-sources/subscribed/csd#using-the-csd-remote-desktop,https://resources.psdi.ac.uk/service/68ff025c-335e-486a-b44d-ec40b1f691b3,1.0,"The Cambridge Structural Database (CSD), provided by the Cambridge Crystallographic Data Centre (CCDC), is the world's largest curated repository of experimental crystal structures. It contains over 1.3 million accurate 3D structures derived from X-ray, neutron, and electron diffraction analyses. The database is used by researchers across the pharmaceutical, agrochemical, and fine chemicals industries to predict and guide future discoveries. 
Authenticated users from the UK academic community can access a Remote Desktop computer with software from the Cambridge Crystallographic Data Centre (CCDC) that can be used to query CSD data. 
The following software is available: 
- ConQuest (For searching and retrieving CSD data)
- Mercury (A range of 3D structure visualisation tools)
- Mogul (Preferred molecular geometries within the CSD).
- PreQuest (Now deprecated) 
Use the Visit or resource landing page link to find out how to request or get help with access to the CSD Software (Remote Desktop Access) service. See Linked Resources for links to the CSD in the Cross Data Search service (Cambridge Structural Database (CSD)) and the dedicated Web Access to Cambridge Structural Database (webCSD) service."
PSDI Subscribed Resources,Web Access to Cambridge Structural Database (webCSD),Service,http://web-csd.psdi.ac.uk,https://resources.psdi.ac.uk/service/12bde9eb-5553-4dc8-8341-63cbf9e26c37,1.0,"The Cambridge Structural Database (CSD), provided by the Cambridge Crystallographic Data Centre (CCDC), is the world's largest curated repository of experimental crystal structures. It contains over 1.3 million accurate 3D structures derived from X-ray, neutron, and electron diffraction analyses. The database is used by researchers across the pharmaceutical, agrochemical, and fine chemicals industries to predict and guide future discoveries. 
Access to the CSD through PSDI is restricted to authenticated users from the UK academic community. The CSD can be searched using the 'Find a Substance' search within the PSDI Cross Data Service or by using the dedicated webCSD service. Software for working with CSD can also be accessed using our Remote Desktop Access. 
Use the Visit or resource landing page link to search the CSD using the dedicated webCSD service. See Linked Resources for links to the CSD in the Cross Data Search service (Cambridge Structural Database (CSD)) and CSD Software (Remote Desktop Access)."
PSDI Subscribed Resources,Web Access to Inorganic Crystal Structure Database (ICSD Web),Service,https://icsd-web.psdi.ac.uk,https://resources.psdi.ac.uk/service/d9556f5e-9a66-4ae6-ab20-d2235957c22b,1.0,"The Inorganic Crystal Structure Database (ICSD), provided by FIZ Karlsruhe, is the world's largest database for completely identified inorganic crystal structures containing over 325,000 crystal structures. Currently it contains the following types of crystal structures: experimentally determined inorganic and organometallic structures, and theoretically calculated inorganic structures. ICSD also includes simulation of powder diffraction data. Results data include unit cell, space group, complete atomic parameters, site occupation factors, Wyckoff sequence, molecular formula and weight, ANX formula, and mineral group. 
Access to ICSD through PSDI is restricted to authenticated users from the UK academic community. ICSD can be searched using a dedicated online interface developed and maintained by FIZ Karlsruhe. The interface functionalities include:
- intuitive search interface
- extensive classification in structure types, which are searchable based on descriptors defining each structure type
- structure standardization for easier comparison with other structures
- extended crystal structure visualization and analysis tools
- powder pattern simulation with the possibility of enhanced manipulation
- simple but powerful query management
- direct links to the original literature via OpenURL server."
PSDI Subscribed Resources,Web Access to DETHERM (Thermophysical Property Data),Service,https://detherm.psdi.ac.uk,https://resources.psdi.ac.uk/service/43f76f68-abd1-4fa4-802a-1d76ec2e1358,1.0,"DETHERM, provided by DECHEMA, is one of the world's largest thermophysical databases containing thermophysical property data from a collection of databases. DETHERM contains over 13 million data sets representing more than 100,000 pure compounds and 200,000 mixtures. The database holds information on phase equilibrium data, vapor pressures, thermodynamic properties, transport properties, surface tensions, and electrolyte data. The database also contains bibliographic and literature information including descriptors and abstracts. DETHERM can be searched using the dedicated DETHERM web portal. Search results can be constrained by phase, temperature, pressure, and number of components.
The following databases are part of DETHERM:
- DDB: Dortmunder Datenbank
- ELDAR: Electrolyte data collection
- INFOTHERM: Thermophysical database
- COMDOR: Thermophysical Parameter database
- C-DATA Data Collection
- BDBB: Basic Database Bohlen
- CAPEC-SDB: Solubility Database
- Additional data by DECHEMA."
