Resource Theme Name,Resource Name,Resource Type,URL,ResourceCatalogueURL,Priority,Description
TopoStats and AFMDB: Resources for Atomic Force Microscopy (AFM) Image Analysis,Atomic Force Microscopy Database (AFMDB),Data,https://data-collections.psdi.ac.uk/communities/afmdb,https://resources.psdi.ac.uk/data/b21d01f6-20df-49da-a19a-88f7b42fbd11,2.0,"The AFMDB repository is a centralised data facility which contains Atomic Force Microscopy data of physical and biological materials. The repository contains AFM files, alongside a processed image file from analysis. Initial examples demonstrate the output from our open-source tool TopoStats which has been used to process images and standardised the data output."
TopoStats and AFMDB: Resources for Atomic Force Microscopy (AFM) Image Analysis,TopoStats: Batch Processing Atomic Force Microscopy (AFM) Images,Tool,https://pypi.org/project/topostats,https://resources.psdi.ac.uk/tool/e03c049a-fac0-4c00-8f71-a61f45d22d4d,2.0,"TopoStats, allows for the batch processing of AFM datafiles to obtain rich, quantitative statistics and adheres to the FAIR principles of research software."
,PSDI Cross Data Search,Service,http://data-search.psdi.ac.uk,https://resources.psdi.ac.uk/service/6bc7c64d-ee3d-430b-be09-f26040886c3c,1.0,"The PSDI Cross Data Search service enables users to search for data across data sources provided by PSDI and other relevant data sources from the wider community using our online interface. The service provides a number of different ways to perform a search, for example searching substances by chemical formula, name, or number of elements, with the option to refine searches using a periodic table interface. Specialised searches can also be performed for molecules using  molecular structures, crystalline forms, or specific symmetry or periodicity characteristics. There is also an advanced search option, enabling custom queries to be constructed for users who know which fields in the data sources they want to search. The search results provide both a summary of the data and links to the source of the data. Although the majority of data sources are completely open, authentication may be required for some data sources."
,PSDI Community Data Collections,Service,http://data-collections.psdi.ac.uk,https://resources.psdi.ac.uk/service/d81616df-3daf-44c3-98b4-841e277dfe08,1.0,"PSDI Community Data Collections is a collaborative, subject-focused research data repository within the Physical Sciences Data Infrastructure (PSDI). It provides openly accessible datasets, currently serving the BioSim and Data to Knowledge communities, to facilitate the publication, sharing, discovery, and reuse of valuable data. The repository adheres to FAIR principles by implementing a comprehensive metadata schema that incorporates both standard properties and custom fields tailored to scientific needs. Metadata and full datasets are freely available to all users, and plans are in place to expand PSDI Community Data Collections by including additional relevant scientific communities in the future."
,PSDI Knowledge Base,Service,https://guidance.psdi.ac.uk/docusaurus-pages,https://resources.psdi.ac.uk/service/2927c4a2-0178-4cc9-a839-240ec1d343a6,1.0,"The PSDI Knowledge Base serves as a comprehensive resource for physical scientists and research support staff, offering guidance on a variety of themes related to research data, PSDI technologies and related resources. It also provides centralized access to a variety of training and learning, including self-paced courses, tutorials, webinar recordings, and in-person sessions such as workshops and summer schools. Additionally, the Knowledge Base offers technical support resources, including FAQs to address common challenges, guidance on how to contact us, and how to raise a support request if you can't find an answer to your question."
,PSDI Interactive Learning (Moodle),Service,https://learn.psdi.ac.uk,https://resources.psdi.ac.uk/service/62af1a1c-f4c9-48ee-acc2-45b19fb8b231,1.0,"A range of interactive, self-paced learning modules provided by PSDI."
